{
  "recordId": "HDIP-CLA-A9-11-REALIZATION_PROFILE_BINDING_DECLARATION",
  "version": "0.1",
  "scope": "Illustrative Compound Data / Information / Intelligence Product Composition; non-normative and NOT_ASSESSED",
  "sourceAuthority": "HDIP-CLA-0.1-M17",
  "realizationPatternRefs": [
    "M14-RP-04"
  ],
  "profileDeclarationRefs": [
    "HDIP-CLA-A9-11-PROFILE_DECLARATION"
  ],
  "mappedLogicalResponsibilityRefs": [
    "P2-ABB-01"
  ],
  "mappingDoesNotTransferAuthority": true
}
