{
  "recordId": "HDIP-CLA-A9-02-REALIZATION_PROFILE_BINDING_DECLARATION",
  "version": "0.1",
  "scope": "Illustrative Information Product Formation from Governed Products/Capabilities; non-normative and NOT_ASSESSED",
  "sourceAuthority": "HDIP-CLA-0.1-M17",
  "realizationPatternRefs": [
    "M14-RP-02"
  ],
  "profileDeclarationRefs": [
    "HDIP-CLA-A9-02-PROFILE_DECLARATION"
  ],
  "mappedLogicalResponsibilityRefs": [
    "P2-ABB-01"
  ],
  "mappingDoesNotTransferAuthority": true
}
