{
  "recordId": "HDIP-CLA-A9-03-REALIZATION_PROFILE_BINDING_DECLARATION",
  "version": "0.1",
  "scope": "Illustrative AI Product / Intelligence Capability Realization with External Provider; non-normative and NOT_ASSESSED",
  "sourceAuthority": "HDIP-CLA-0.1-M17",
  "realizationPatternRefs": [
    "M14-RP-07"
  ],
  "profileDeclarationRefs": [
    "HDIP-CLA-A9-03-PROFILE_DECLARATION"
  ],
  "mappedLogicalResponsibilityRefs": [
    "P2-ABB-01"
  ],
  "mappingDoesNotTransferAuthority": true
}
