{
  "recordId": "HDIP-CLA-A9-10-REALIZATION_PROFILE_BINDING_DECLARATION",
  "version": "0.1",
  "scope": "Illustrative Provider Failure, Migration, Rebinding & Recovery; non-normative and NOT_ASSESSED",
  "sourceAuthority": "HDIP-CLA-0.1-M17",
  "realizationPatternRefs": [
    "M14-RP-08"
  ],
  "profileDeclarationRefs": [
    "HDIP-CLA-A9-10-PROFILE_DECLARATION"
  ],
  "mappedLogicalResponsibilityRefs": [
    "P2-ABB-01"
  ],
  "mappingDoesNotTransferAuthority": true
}
